source_id,candidate_source,source_kind,source_surface,evidence_summary_key,supplies_dominance,supplies_pointwise_h1_tail,supplies_independent_coefficient,target_absorption,bkm,serrin,h1_continuation,theta_preservation,desired_conclusion,epsilon_from_absorption,classification,evidence_note,next_required_input,allowed_source,summary_path,summary_present,summary_contract,summary_complete,summary_route_decision,forbidden_hits,forbidden_hit_count,avoids_forbidden_dependencies,same_source_completeness,accepted,route_decision,source_surface_present
S87A,Sprint87 absorption scaling,scalar absorption condition,scripts/ns_sprint87_absorption_scaling_audit.py; outputs/ns_sprint87_absorption_scaling_audit,sprint87_absorption_scaling,False,False,False,False,False,False,False,False,False,False,SCALAR_CONDITION_ONLY,"Records required scalar law, but does not supply the pointwise tail or independent coefficient.",non-circular tail law and coefficient fixed before absorption,True,outputs/ns_sprint87_absorption_scaling_audit/ns_sprint87_absorption_scaling_summary.json,True,ns_sprint87_absorption_scaling_audit,False,NS_SPRINT87_ABSORPTION_SCALING_OPEN,none,0,True,False,False,fail-closed,True
S87B,Sprint87 danger-shell factorization,high-high factorization receipt,scripts/ns_sprint87_danger_shell_factorization_audit.py; DASHI/Physics/Closure/NSSprint87DangerShellSupFactorizationReceipt.agda,sprint87_factorization,False,False,False,False,False,False,False,False,False,False,FACTORIZATION_SUPPORT_ONLY,"Factorization support is closed, while danger-shell absorption remains the next gate.",pre-absorption dominance with pointwise tail and coefficient,True,outputs/ns_sprint87_danger_shell_factorization_audit/ns_sprint87_danger_shell_factorization_summary.json,True,ns_sprint87_danger_shell_factorization_audit,False,NS_SPRINT87_DANGER_SHELL_FACTORIZATION_ABSORPTION_OPEN,none,0,True,False,False,fail-closed,True
S88A,Sprint88 H1 tail decision,tail-smallness decision receipt,scripts/ns_sprint88_h1_tail_smallness_decision_audit.py; DASHI/Physics/Closure/NSSprint88DangerShellH1TailSmallnessDecisionReceipt.agda,sprint88_h1_tail_decision,False,False,False,False,False,False,False,False,False,False,TAIL_GATE_RECORDED_OPEN,Records that non-circular danger-shell H1-tail smallness is still open.,prove non-circular pointwise H1-tail smallness,True,outputs/ns_sprint88_h1_tail_smallness_decision_audit/ns_sprint88_h1_tail_smallness_decision_summary.json,True,ns_sprint88_h1_tail_smallness_decision_audit,False,NS_SPRINT88_H1_TAIL_SMALLNESS_DECISION_OPEN,none,0,True,False,False,fail-closed,True
S88B,Sprint88 tail source classifier,tail candidate classifier,scripts/ns_sprint88_tail_source_classifier.py; outputs/ns_sprint88_tail_source_classifier,sprint88_tail_classifier,False,False,False,False,False,False,False,False,False,False,ALL_TAIL_CANDIDATES_FAIL_CLOSED,Classifier records zero sufficient sources for pointwise absorption.,one source with pointwise H1 tail and independent coefficient,True,outputs/ns_sprint88_tail_source_classifier/ns_sprint88_tail_source_classifier_summary.json,True,ns_sprint88_tail_source_classifier,False,NS_SPRINT88_TAIL_SOURCE_CLASSIFIER_OPEN,none,0,True,False,False,fail-closed,True
S89A,Sprint89 circularity matrix,forbidden dependency matrix,scripts/ns_sprint89_circularity_matrix_audit.py; outputs/ns_sprint89_circularity_matrix_audit,sprint89_circularity,False,False,False,False,False,False,False,False,False,False,NO_ALLOWED_ROUTE,Matrix rejects current candidates and records no allowed route with both inputs.,allowed same-source route avoiding forbidden dependencies,True,outputs/ns_sprint89_circularity_matrix_audit/ns_sprint89_circularity_matrix_audit_summary.json,True,ns_sprint89_circularity_matrix_audit,False,fail-closed,none,0,True,False,False,fail-closed,True
S89B,Sprint89 pointwise H1 mechanism,pointwise extraction mechanism audit,scripts/ns_sprint89_pointwise_h1_tail_mechanism_audit.py; outputs/ns_sprint89_pointwise_h1_tail_mechanism_audit,sprint89_pointwise_mechanism,False,False,False,False,False,False,False,False,False,False,MECHANISM_OPEN,Pointwise mechanism surface remains an audit of missing analytic extraction.,actual pointwise extraction theorem,True,outputs/ns_sprint89_pointwise_h1_tail_mechanism_audit/ns_sprint89_pointwise_h1_tail_mechanism_summary.json,True,ns_sprint89_pointwise_h1_tail_mechanism_audit,False,fail_closed,none,0,True,False,False,fail-closed,True
S90A,Sprint90 epsilon budget solver,scalar/numeric budget solver,scripts/ns_sprint90_epsilon_budget_solver.py; outputs/ns_sprint90_epsilon_budget_solver,sprint90_epsilon_solver,False,False,False,False,False,False,False,False,False,False,SOLVER_NEEDS_SUPPLIED_EVIDENCE,"Solver can validate a supplied law but does not itself supply dominance, tail, or coefficient evidence.",feed supplied pointwise tail and independent coefficient,True,outputs/ns_sprint90_epsilon_budget_solver/ns_sprint90_epsilon_budget_solver_summary.json,True,ns_sprint90_epsilon_budget_solver,missing,fail-closed,none,0,True,False,False,fail-closed,True
S90B,Sprint90 local enstrophy,local enstrophy/dissipation reduction receipt,scripts/ns_sprint90_local_enstrophy_budget_audit.py; DASHI/Physics/Closure/NSSprint90LocalEnstrophyDangerShellReductionReceipt.agda,sprint90_local_enstrophy,False,False,False,False,False,False,False,False,False,False,LOCAL_ENSTROPHY_REDUCTION_ONLY,"Relevant local-enstrophy receipt records reduction bookkeeping, with dominance, pointwise tail, and coefficient flags false.",close local dissipation dominance and pointwise extraction non-circularly,True,outputs/ns_sprint90_local_enstrophy_budget_audit/ns_sprint90_local_enstrophy_budget_audit_summary.json,True,ns_sprint90_local_enstrophy_budget_audit,False,NS_SPRINT90_LOCAL_ENSTROPHY_BUDGET_ROUTE_OPEN,none,0,True,False,False,fail-closed,True
S91A,Sprint91 coefficient independence,coefficient classifier,scripts/ns_sprint91_coefficient_independence_audit.py; outputs/ns_sprint91_coefficient_independence_audit,sprint91_coefficient_independence,False,False,False,False,False,False,False,False,False,False,NO_INDEPENDENT_COEFFICIENT_SOURCE,Finds no allowed source with both pointwise H1 tail and independent coefficient.,coefficient fixed independently on same source as tail and dominance,True,outputs/ns_sprint91_coefficient_independence_audit/ns_sprint91_coefficient_independence_audit_summary.json,True,ns_sprint91_coefficient_independence_audit,False,fail-closed,none,0,True,False,False,fail-closed,True
S91B,Sprint91 localized flux identity,localized flux identity bookkeeping,scripts/ns_sprint91_localized_flux_identity_audit.py; DASHI/Physics/Closure/NSSprint91LocalizedFluxIdentityAndCoefficientBudget.agda,sprint91_localized_flux,False,False,False,False,False,False,False,False,False,False,IDENTITY_BOOKKEEPING_ONLY,"Localized identity bookkeeping is closed; dominance, tail, and coefficient gates remain false.",analytic domination theorem with pointwise extraction and coefficient,True,outputs/ns_sprint91_localized_flux_identity_audit/ns_sprint91_localized_flux_identity_audit_summary.json,True,ns_sprint91_localized_flux_identity_audit,False,NS_SPRINT91_LOCALIZED_FLUX_IDENTITY_ROUTE_OPEN,none,0,True,False,False,fail-closed,True
S92A,Sprint92 high-high dominance budget,target dominance budget audit,scripts/ns_sprint92_high_high_dominance_budget_audit.py; outputs/ns_sprint92_high_high_dominance_budget_audit,sprint92_high_high_dominance,False,False,False,False,False,False,False,False,False,False,DOMINANCE_BUDGET_FAIL_CLOSED,Direct dominance audit records no allowed source closing target dominance with both required inputs.,one allowed non-circular dominance source,True,outputs/ns_sprint92_high_high_dominance_budget_audit/ns_sprint92_high_high_dominance_budget_audit_summary.json,True,ns_sprint92_high_high_dominance_budget_audit,False,fail-closed,none,0,True,False,False,fail-closed,True
S92B,Sprint92 moving K* boundary,moving K localization boundary audit,scripts/ns_sprint92_moving_kstar_boundary_audit.py; DASHI/Physics/Closure/NSSprint92MovingKStarLocalizationBoundary.agda,sprint92_moving_kstar,False,False,False,False,False,False,False,False,False,False,MOVING_BOUNDARY_OPEN,"Frozen-K bookkeeping is recorded, but moving boundary, dominance, tail, and coefficient gates remain false.",moving K* boundary plus dominance/tail/coefficient source,True,outputs/ns_sprint92_moving_kstar_boundary_audit/ns_sprint92_moving_kstar_boundary_audit_summary.json,True,ns_sprint92_moving_kstar_boundary_audit,False,open,none,0,True,False,False,fail-closed,True
X1,Split-source dominance tail coefficient attempt,rejected multi-source assembly,outputs/ns_sprint90_local_enstrophy_budget_audit; outputs/ns_sprint91_coefficient_independence_audit; outputs/ns_sprint92_high_high_dominance_budget_audit,sprint92_high_high_dominance,False,False,False,False,False,False,False,False,False,False,REJECT_SPLIT_SOURCE_ASSEMBLY,"Separate surfaces discuss parts of the desired package, but no same source supplies dominance, pointwise H1 tail, and independent coefficient.",one same-source proof surface carrying all three inputs,False,outputs/ns_sprint92_high_high_dominance_budget_audit/ns_sprint92_high_high_dominance_budget_audit_summary.json,True,ns_sprint92_high_high_dominance_budget_audit,False,fail-closed,none,0,True,False,False,fail-closed,True
F1,Adjacent leakage / target absorption reuse,forbidden absorption-derived coefficient,DASHI/Physics/Closure/NSAdjacentShellLeakageBoundReceipt.agda,sprint87_absorption_scaling,False,False,False,True,False,False,False,False,False,True,REJECT_TARGET_ABSORPTION_EPSILON_REUSE,Leakage estimates tied to the target absorption epsilon are circular for coefficient supply.,coefficient fixed before and outside target absorption,False,outputs/ns_sprint87_absorption_scaling_audit/ns_sprint87_absorption_scaling_summary.json,True,ns_sprint87_absorption_scaling_audit,False,NS_SPRINT87_ABSORPTION_SCALING_OPEN,target_absorption; epsilon_from_absorption,2,False,False,False,fail-closed,True
F2,Target conclusion / continuation shortcuts,forbidden downstream regularity route,BKM/Serrin/H1 continuation/theta preservation/desired conclusion shortcuts,sprint89_circularity,True,True,True,True,True,True,True,True,True,True,REJECT_FORBIDDEN_DEPENDENCIES_EVEN_IF_COMPLETE,This synthetic rejection row proves the matrix rejects forbidden complete-looking routes.,same facts from an allowed pre-continuation source,False,outputs/ns_sprint89_circularity_matrix_audit/ns_sprint89_circularity_matrix_audit_summary.json,True,ns_sprint89_circularity_matrix_audit,False,fail-closed,target_absorption; bkm; serrin; h1_continuation; theta_preservation; desired_conclusion; epsilon_from_absorption,7,False,True,False,fail-closed,False
