row_id,gate,term_class,term_or_relation,status,role_at_first_positive_max,budget_effect,support,missing_evidence,domination_required,domination_available,global_barrier_closed,clay_navier_stokes_promoted
barrier_equation_inventory,TransportCommutatorDominationForVBarrier,equation_inventory,D_t v = nu Ltilde v + 2 v partial_z psi1 + 2 u1 partial_z^2 psi1 - (partial_z u^r) partial_r u1 - (partial_z u^z) v,encoded,Defines the exact local budget to be tested at the first positive maximum of v.,Diffusion is nonpositive; homogeneous v terms are linear in the positive maximum; two nonhomogeneous terms remain: 2 u1 partial_z^2 psi1 and -(partial_z u^r) partial_r u1.,"Sprint137 axial monotonicity gate; D_t u1 = 2 u1 partial_z psi1 + nu Ltilde u1; At the first interior positive maximum of v, v>0, partial_r v=partial_z v=0, and Ltilde v<=0.",,True,False,False,False
homogeneous_v_terms_first_positive_max,TransportCommutatorDominationForVBarrier,homogeneous_v,2 v partial_z psi1 - (partial_z u^z) v,linear_growth_not_obstruction_by_itself,"At v>0 these terms are proportional to the maximum value of v, not independent positive forcing.",They can be placed in a Gronwall coefficient if the coefficient partial_z psi1 and partial_z u^z is time integrable along the barrier window.,first positive maximum geometry; standard parabolic barrier accounting,uniform time-integrable strain coefficient without losing a logarithmic factor,True,False,False,False
nonhomogeneous_radial_commutator,TransportCommutatorDominationForVBarrier,nonhomogeneous_commutator,-(partial_z u^r) partial_r u1,open_hazard,This term does not contain v and therefore can inject a positive source at the first crossing even when v is just becoming positive.,A local v barrier needs either a sign rule for -(partial_z u^r) partial_r u1 or a domination inequality against the favorable concavity/source/diffusion margin.,transport commutator from differentiating u^r partial_r u1; D_t v = nu Ltilde v + 2 v partial_z psi1 + 2 u1 partial_z^2 psi1 - (partial_z u^r) partial_r u1 - (partial_z u^z) v,pointwise sign of partial_z u^r times partial_r u1; scale-uniform upper bound absorbed by negative terms; structural cancellation with 2 u1 partial_z^2 psi1,True,False,False,False
incompressibility_relation_limitations,TransportCommutatorDominationForVBarrier,constraint_limitation,partial_r u^r + u^r/r + partial_z u^z = 0; partial_z^2 u^z = -partial_z partial_r u^r - partial_z(u^r/r),insufficient_for_domination,Incompressibility relates components of the strain but does not determine the sign of partial_z u^r or its correlation with partial_r u1 at the crossing.,"The homogeneous -(partial_z u^z)v can be rewritten as part of a trace-free strain coefficient, but the radial commutator remains a separate nonhomogeneous source.",axisymmetric divergence-free relation; trace-free strain accounting,correlation theorem linking partial_z u^r to partial_r u1; boundary-compatible one-sided strain sign,True,False,False,False
log_biot_savart_strain_hazard,TransportCommutatorDominationForVBarrier,strain_hazard,"partial_z u^r, partial_z u^z, and partial_z psi1 inherit nonlocal Biot-Savart strain bounds with the restored coincident-ring logarithmic loss.",open_log_loss,The barrier needs strain coefficients to be controlled at the same scale where v first crosses; the log loss can amplify both homogeneous growth and the commutator bound.,A polynomial viscous or local concavity margin is not enough unless it explicitly absorbs log-amplified strain.,Sprint134: NoLogAxisymmetricBiotSavartUniform false; standard axisymmetric Biot-Savart kernel singularity,no-log replacement estimate on the active barrier support; log-aware domination inequality; localized cancellation removing the coincident-ring loss,True,False,False,False
domination_hypothesis_pointwise_sign,TransportCommutatorDominationForVBarrier,possible_domination_hypothesis,-(partial_z u^r) partial_r u1 <= 0 at every possible first positive maximum of v,hypothesis_not_established,"If true, the nonhomogeneous radial commutator would not help create the first positive crossing.",This would reduce the local barrier back to homogeneous strain plus the already tracked 2 u1 partial_z^2 psi1 term.,candidate monotone radial profile intuition; local primary-peak geometry only,global pointwise sign theorem; secondary-peak compatibility; nonlocal Biot-Savart sign preservation,False,False,False,False
domination_hypothesis_integrated_margin,TransportCommutatorDominationForVBarrier,possible_domination_hypothesis,"|(partial_z u^r) partial_r u1| <= margin from -2 u1 partial_z^2 psi1, -nu Ltilde v, or an integrated barrier weight",hypothesis_not_established,"If a scale-uniform margin existed, a positive commutator burst could be absorbed before it creates a global crossing.","The required estimate must be log-aware, boundary-aware, and valid at any first-crossing location, not only near the primary axial maximum.",possible weighted maximum-principle route; possible localized Biot-Savart cancellation route,explicit margin inequality; constants uniform through the Hou-Luo scaling window; axis and boundary exclusion for the crossing set,False,False,False,False
current_fail_closed_status,TransportCommutatorDominationForVBarrier,decision,commutator domination open; local barrier not globally closed; no Clay promotion,fail_closed,The ledger permits local barrier bookkeeping but refuses to upgrade it to global axial monotonicity.,Transport commutator domination remains an explicit open gate for any future Hou-Luo barrier proof.,Sprint137 local barrier blockers; Sprint138 commutator budget rows,CommutatorDominationForVBarrier; global barrier closure; Clay-level regularity theorem,True,False,False,False
