criterion_id,criterion_name,criterion_family,scope,status,inventory_note,sprint,lane,contract,support_not_exhaustive,closed_scoped_class,SymmetricHouLuoRegularityClassClosure,SymmetricAxisymmetricWithSwirlGlobalRegularity,MechanismExhaustionForFullClayNS,GeneralSmoothFiniteEnergyNSRegularity,full_clay,fullClay,full_clay_ns_solved,fullClayNSSolved,fullNavierStokesSolutionConstructed,clay_navier_stokes_promoted,promotion_allowed,row_hash
bkm_continuation,BKM continuation,continuation,smooth_solution_continuation_control,SUPPORT_NOT_EXHAUSTIVE,Finite vorticity-sup norm time integral supports continuation but does not exhaust all full-NS singularity mechanisms.,159,4,ns_sprint159_criteria_inventory,True,False,False,False,False,False,False,False,False,False,False,False,False,8f2ff34024345c576c0340619442785bde7ae302c064dbe5f1d7ed62831461d0
prodi_serrin_ladyzhenskaya,Prodi-Serrin/Ladyzhenskaya,integrability,scale-compatible_velocity_integrability,SUPPORT_NOT_EXHAUSTIVE,Velocity space-time integrability criteria support regularity under added bounds and remain conditional.,159,4,ns_sprint159_criteria_inventory,True,False,False,False,False,False,False,False,False,False,False,False,False,ff468c27eca88b54f7af257c6184fba4e2703ca5bfab7c47b092424257f8857d
escauriaza_seregin_sverak_critical_l3,Escauriaza-Seregin-Sverak critical L3/L3inf-style criterion,critical_space,critical_l3_endpoint_control,SUPPORT_NOT_EXHAUSTIVE,Critical L3 endpoint control rules out blowup under the criterion but is not a universal mechanism-exhaustion theorem.,159,4,ns_sprint159_criteria_inventory,True,False,False,False,False,False,False,False,False,False,False,False,False,5d4c1c0866b7426c630249d0045c78b3f9171ad4818c54d099abf9ff8f9c3c57
caffarelli_kohn_nirenberg_partial_regularity,Caffarelli-Kohn-Nirenberg partial regularity,partial_regularity,suitable_weak_solution_singular_set_control,SUPPORT_NOT_EXHAUSTIVE,Partial regularity bounds the possible singular set and does not by itself close full smooth regularity.,159,4,ns_sprint159_criteria_inventory,True,False,False,False,False,False,False,False,False,False,False,False,False,9f5ae572fa2fc1a4bce78581a3a0c05e9a6ec5356e73c7ca66fcde3140bdadeb
koch_tataru_small_data_critical_space,Koch-Tataru small-data critical-space,small_data,critical_space_small_data_global_wellposedness,SUPPORT_NOT_EXHAUSTIVE,"Small critical-space data produce global control in that regime, not an exhaustive large-data Clay solution.",159,4,ns_sprint159_criteria_inventory,True,False,False,False,False,False,False,False,False,False,False,False,False,2392a52a3c3ef1c6602e1b60b67b2e94302d822494bcb209e089d1c48026fc68
symmetric_hou_luo_sprint157_158_closure,Symmetric Hou-Luo Sprint157/158 closure,scoped_symmetric_class,axisymmetric_with_swirl_z_reflection_symmetric_class,CLOSED_SCOPED_CLASS,Sprint157/158 close the symmetric Hou-Luo class through BKM and theorem-scope closure only.,159,4,ns_sprint159_criteria_inventory,False,True,True,True,False,False,False,False,False,False,False,False,False,aeeaece0f24a7f022088d8de61ecd6518c637ae865e48fc3cb2fbe0521455cf2
