row_id,blocker,parent_gate,status,ledger_role,statement,obstruction_mechanism,support,missing_evidence,local_concavity_supported,global_concavity_closed,blocker_open,full_clay_ns_solved,clay_navier_stokes_promoted
local_taylor_concavity_near_symmetry_center,GlobalConcavityOfPsi1,AxialMonotonicityOfSwirlProfile,supported_local,local_center_expansion,"At the z-reflection symmetry center, a local Taylor expansion can support partial_z^2 psi1<=0 in a small neighborhood of the primary axial maximum, provided the center is a genuine concave stream-profile peak.",This controls only a local patch and does not rule out off-center first positive crossings of v.,z-reflection symmetry; primary axial maximum geometry; local Taylor concavity near z=0,uniform radius of validity; control of crossings outside the local Taylor patch,True,False,True,False,False
elliptic_nonlocal_psi1_dependence_on_omega1,GlobalConcavityOfPsi1,AxialMonotonicityOfSwirlProfile,open_blocker,elliptic_nonlocality,"The stream variable psi1 is determined by the elliptic relation -Ltilde psi1 = omega1, so partial_z^2 psi1 depends nonlocally on the full omega1 distribution rather than only on the local sign structure near the symmetry center.",A local peak calculation for omega1 or psi1 cannot by itself force global concavity of psi1.,-Ltilde psi1 = omega1; Sprint134 corrected axisymmetric elliptic coupling,global elliptic comparison theorem for partial_z^2 psi1; monotone-preserving Biot-Savart representation in the full domain,False,False,True,False,False
sign_indefinite_kernel_contribution,GlobalConcavityOfPsi1,AxialMonotonicityOfSwirlProfile,open_blocker,kernel_sign,"The differentiated elliptic kernel contributing to partial_z^2 psi1 is sign-indefinite across source locations, so favorable near-center mass can be offset by remote or asymmetric omega1 contributions.",The maximum-principle source term 2 u1 partial_z^2 psi1 can become positive at an admissible crossing if the nonlocal kernel contribution has the wrong sign.,second z-derivatives of Green-kernel representations change sign; nonlocal omega1-to-psi1 coupling,signed kernel dominance estimate; cancellation bound strong enough for every first-crossing site,False,False,True,False,False
boundary_annular_contribution,GlobalConcavityOfPsi1,AxialMonotonicityOfSwirlProfile,open_blocker,boundary_and_annulus,"Boundary layers, annular mass away from the axis, and outer domain contributions can alter partial_z^2 psi1 at an interior point even when the symmetry-center profile remains locally concave.",A first positive maximum of v can occur in an annular or near-boundary region where the local center concavity ledger has no sign authority.,elliptic boundary sensitivity; annular source distributions in axisymmetric coordinates,boundary-compatible global barrier for psi1 concavity; annular contribution exclusion or domination estimate,False,False,True,False,False
persistence_failure,GlobalConcavityOfPsi1,AxialMonotonicityOfSwirlProfile,open_blocker,time_persistence,"Even if the initial profile has a favorable concavity patch, the current route has no persistence theorem showing that partial_z^2 psi1 keeps the required sign over the time window needed for axial monotonicity.","The barrier argument needs sign control at the first crossing time, not merely at initial time or at the symmetry center.",Sprint137 first-positive-crossing ledger; time-dependent nonlocal elliptic solve,transport-stable concavity invariant; a priori estimate preventing concavity loss before crossing,False,False,True,False,False
required_theorem_global_concavity_of_psi1,GlobalConcavityOfPsi1,AxialMonotonicityOfSwirlProfile,required_theorem_missing,closure_requirement,"For every possible first positive maximum of v=partial_z u1 in the monitored half-profile, partial_z^2 psi1 must keep the sign needed to make 2 u1 partial_z^2 psi1 nonpositive or otherwise dominated.","Without this theorem, AxialMonotonicityOfSwirlProfile cannot be closed from the local symmetry-center calculation.",local concavity support only; maximum-principle source sign requirement from Sprint137,GlobalConcavityOfPsi1; signed nonlocal elliptic estimate; boundary and annular contribution control; time persistence of the concavity sign,False,False,True,False,False
