source_id,candidate_source,source_kind,source_surface,allowed_source,supplies_pointwise_h1_tail,supplies_independent_coefficient,h1_continuation,serrin,bkm,target_absorption,theta_preservation,clay_regularities,desired_conclusion,epsilon_from_absorption,classification,evidence_note,next_required_input,forbidden_hits,forbidden_hit_count,avoids_forbidden_dependencies,requires_pointwise_h1_tail,requires_independent_coefficient,evidence_complete,accepted,route_decision,source_surface_present
S1,fixed-K LP identity,fixed cutoff tail-flux identity,DASHI/Physics/Closure/NSTailFluxLPIdentityAnalyticReceipt.agda; DASHI/Physics/Closure/NSTailFluxIdentityAnalyticTargetReceipt.agda,True,False,False,False,False,False,False,False,False,False,False,IDENTITY_ONLY_NO_POINTWISE_OR_COEFFICIENT,"Records fixed-K flux bookkeeping and analytic target semantics, but not a pointwise H1 tail or independent epsilon coefficient.",derive a non-circular pointwise H1 tail and a coefficient budget not chosen from the absorption conclusion,none,0,True,True,True,False,False,fail-closed,True
S2,adjacent leakage bound,adjacent shell influx estimate,DASHI/Physics/Closure/NSAdjacentShellLeakageBoundReceipt.agda,True,False,False,False,False,False,True,False,False,False,True,TARGET_ABSORPTION_COEFFICIENT_REUSE,"The leakage estimate is phrased against an epsilon absorption budget, so it cannot certify coefficient independence.",external leakage coefficient fixed before invoking target absorption,target_absorption; epsilon_from_absorption,2,False,True,True,False,False,fail-closed,True
S3,local-enstrophy candidate,danger-shell local enstrophy route,DASHI/Physics/Closure/NSSprint90LocalEnstrophyDangerShellReductionReceipt.agda; scripts/ns_sprint90_local_enstrophy_budget_audit.py,True,False,False,False,False,False,False,False,False,False,False,REDUCTION_BOOKKEEPING_ONLY,Sprint 90 records local-enstrophy reduction bookkeeping while leaving actualPointwiseH1TailClosureClosed=false and independentEpsilonCoefficientClosed=false.,"close the local flux identity, pointwise extraction, and independent coefficient gates",none,0,True,True,True,False,False,fail-closed,True
S4,scalar epsilon solver,numeric/asymptotic scalar budget,scripts/ns_sprint90_epsilon_budget_solver.py,True,False,False,False,False,False,False,False,False,False,False,SOLVER_REQUIRES_EVIDENCE,The scalar solver can check C*(K*)^-1/2*H1Tail <= epsilon*nu only after a supplied candidate already provides both required inputs.,feed the solver an allowed supplied pointwise tail law with independent coefficient,none,0,True,True,True,False,False,fail-closed,True
S5,target absorption,desired absorption conclusion,DASHI/Physics/Closure/NSAdjacentShellLeakageBoundReceipt.agda,False,False,False,False,False,False,True,False,False,True,True,FORBIDDEN_TARGET_SELF_USE,Using the target absorption inequality to choose the epsilon coefficient is circular and forbidden.,coefficient source fixed independently before the absorption step,target_absorption; desired_conclusion; epsilon_from_absorption,3,False,True,True,False,False,fail-closed,True
