row_id,ledger_role,status,statement,boundary_effect,annular_effect,sign_or_cancellation_state,required_input,local_support_available,boundary_compatible,annulus_compatible,global_concavity_closed,blocker_open,global_proof,clay_navier_stokes_promoted,promotion_allowed,row_hash
interior_local_support,interior_local_patch,supported_local_only,Interior Taylor data near the symmetry-center peak can support a local favorable sign for partial_z^2 psi1.,The local calculation does not include reflected or boundary image contributions from the elliptic solve.,The local patch does not control source mass in radial annuli away from the symmetry center.,local_sign_available_no_global_cancellation,uniform localization radius | proof that admissible first crossings remain inside the local patch,True,False,False,False,True,False,False,False,95d1bf05489dfcde6e2636fb2d3b77c3240ff96446d345d8bc481bf264c7a35f
boundary_image_sign_hazard,boundary_kernel_effect,open_sign_hazard,Boundary-compatible Green representations can introduce image or correction terms whose second axial derivative is not signed by the interior local peak calculation.,A near-boundary source or crossing can receive a contribution with the wrong sign for the barrier source term.,Annular source placement can couple with boundary corrections and change the sign balance at an interior crossing.,boundary_kernel_sign_not_certified,boundary-compatible signed kernel theorem | or boundary correction cancellation estimate | or domination bound uniform over admissible boundary layers,False,False,False,False,True,False,False,False,13ffeb581aff87f1902a76e4da9bdd540b16a54d5a55c1be8480558921f20bc3
annular_shoulder_hazard,annular_source_geometry,open_annular_hazard,Annular shoulders of omega1 away from the axis can contribute to partial_z^2 psi1 at a candidate crossing through the nonlocal elliptic kernel.,Outer-domain and boundary geometry can amplify or redirect the annular contribution rather than preserving the local sign.,A radial shoulder can offset favorable center mass and make 2 u1 partial_z^2 psi1 positive at an admissible first crossing.,annular_cancellation_not_proved,annular exclusion theorem | annular signed-kernel dominance theorem | or cancellation estimate covering off-axis source mass,False,False,False,False,True,False,False,False,877cf64b957eb4ef404f5e79a5d8018064010f7eb8256d7d85a4ad153efb20e3
axis_regularity_compatibility,axis_and_regular_boundary_interface,compatibility_unproved,Any global concavity theorem must be compatible with the axisymmetric regularity conditions at r=0 and with the boundary conditions used by the elliptic psi1 solve.,Boundary conditions must preserve the claimed sign after differentiating the elliptic representation twice in z.,Regularity at the axis does not rule out off-axis annular source configurations.,axis_regular_but_global_sign_unlinked,"axis-regular kernel theorem | boundary-condition compatibility proof | uniform statement over interior, axis-adjacent, and annular cases",False,False,False,False,True,False,False,False,265ea3af185d97e88f007995f2d67cc98a8eb1da11d346ba35ce410ee2bfed92
missing_theorem,required_theorem_interface,missing_boundary_compatible_kernel_sign_cancellation_theorem,"GlobalConcavityOfPsi1 remains blocked until an explicit theorem signs, dominates, or cancels boundary and annular contributions for every admissible first positive crossing.",No boundary-compatible kernel/sign/cancellation theorem is available in this ledger.,"No annular shoulder exclusion, dominance, or cancellation theorem is available in this ledger.",missing_required_theorem,BoundaryCompatibleKernelSignCancellationForPsi1Concavity | quantitative constants compatible with the monitored barrier route | formal promotion receipt that preserves no-gap assumptions,False,False,False,False,True,False,False,False,eb7e21cbebe3eeadb5d5722821d80a1d282b58917be9fe462b2eee774d4e1c3f
